{
  "acquired_at": "2026-09-11T15:33:08Z",
  "compatibility": [
    {
      "component": "transformers",
      "constraint": "validated == 5.16.1",
      "evidence": "siglip2-local-smoke-v1"
    },
    {
      "component": "torch",
      "constraint": "validated == 2.14.0+cu130",
      "evidence": "siglip2-local-smoke-v1"
    }
  ],
  "files": [
    {
      "path": "config.json",
      "sha256": "fe8b5fe6d5734360678fd71c11c21e1ea3364bd8598d34295d9206335973ffd7",
      "size_bytes": 253
    },
    {
      "path": "model.safetensors",
      "sha256": "612923381c76ec5a9bed335d1c48827e3f2e506ac31b044b63b2031fadee6a0b",
      "size_bytes": 1500800904
    },
    {
      "path": "preprocessor_config.json",
      "sha256": "9b36b57ebaf20f09bf4c22100ccc21877ea6bfe5aead0c00c59f8af8ccefacfc",
      "size_bytes": 394
    },
    {
      "path": "special_tokens_map.json",
      "sha256": "baec30ea10906f16adb8c18af7a34023002c1746542612b8b41c9f09e1351351",
      "size_bytes": 636
    },
    {
      "path": "tokenizer.json",
      "sha256": "cb9140fae3ac5122c972d37adf83e1248471a38147ad76f8215c8872c6fd8322",
      "size_bytes": 34363039
    },
    {
      "path": "tokenizer.model",
      "sha256": "61a7b147390c64585d6c3543dd6fc636906c9af3865a5548f27f31aee1d4c8e2",
      "size_bytes": 4241003
    },
    {
      "path": "tokenizer_config.json",
      "sha256": "14afe629fe4959b9e0d51e1852b8d9f7ad074f90a1a7125a4fcdd17f06e78fc8",
      "size_bytes": 47164
    }
  ],
  "license": {
    "evidence": [
      "https://huggingface.co/google/siglip2-base-patch16-224/tree/75de2d55ec2d0b4efc50b3e9ad70dba96a7b2fa2",
      "https://huggingface.co/api/models/google/siglip2-base-patch16-224"
    ],
    "observed_spdx_id": "Apache-2.0",
    "redistribution_verified": true
  },
  "logical_id": "embed/siglip2/base-patch16-224",
  "oci": {
    "digest": "sha256:c93e953d44105c8cd59be4b893acee43858e9fcb8b4deb20f83535a2165c1c3d",
    "pullback_verified": true,
    "repository": "ghcr.io/sempersupra/model-artifact-foundry"
  },
  "schema_version": 1,
  "state": "candidate",
  "upstream": {
    "exact_revision": "75de2d55ec2d0b4efc50b3e9ad70dba96a7b2fa2",
    "provider": "huggingface",
    "repository": "google/siglip2-base-patch16-224"
  },
  "validation": {
    "claims": [
      "exact declared upstream revision reacquired",
      "declared file set and hashes verified",
      "model and processor load offline with trust_remote_code disabled",
      "image/text embeddings have expected finite 768-dimensional shapes"
    ],
    "profile": "siglip2-local-smoke-v1",
    "status": "passed",
    "tool_revision": "7304a77647a551f6345853b34faebbe0931d7c29"
  }
}
