{
  "acquired_at": "2026-09-16T00:10:41Z",
  "compatibility": [
    {
      "component": "transformers",
      "constraint": "validated == 5.16.1",
      "evidence": "cross-encoder-msmarco-ranking-smoke-v1"
    },
    {
      "component": "torch",
      "constraint": "validated == 2.14.0+cpu",
      "evidence": "cross-encoder-msmarco-ranking-smoke-v1"
    }
  ],
  "files": [
    {
      "path": "config.json",
      "sha256": "380e02c93f431831be65d99a4e7e5f67c133985bf2e77d9d4eba46847190bacc",
      "size_bytes": 794
    },
    {
      "path": "model.safetensors",
      "sha256": "821d1aa69520101d6e0737f78a042ae25b19e5cb9160701909d10434f4aeb0ae",
      "size_bytes": 90870598
    },
    {
      "path": "special_tokens_map.json",
      "sha256": "3c3507f36dff57bce437223db3b3081d1e2b52ec3e56ee55438193ecb2c94dd6",
      "size_bytes": 132
    },
    {
      "path": "tokenizer.json",
      "sha256": "d241a60d5e8f04cc1b2b3e9ef7a4921b27bf526d9f6050ab90f9267a1f9e5c66",
      "size_bytes": 711396
    },
    {
      "path": "tokenizer_config.json",
      "sha256": "a5c2e5a7b1a29a0702cd28c08a399b5ecc110c263009d17f7e3b415f25905fd8",
      "size_bytes": 1330
    },
    {
      "path": "vocab.txt",
      "sha256": "07eced375cec144d27c900241f3e339478dec958f92fddbc551f295c992038a3",
      "size_bytes": 231508
    }
  ],
  "license": {
    "evidence": [
      "https://huggingface.co/cross-encoder/ms-marco-MiniLM-L6-v2/tree/233902d25c440f23af6f7d6e94d2946bac0bee0a",
      "https://huggingface.co/api/models/cross-encoder/ms-marco-MiniLM-L6-v2"
    ],
    "observed_spdx_id": "Apache-2.0",
    "redistribution_verified": true
  },
  "logical_id": "rerank/cross-encoder/ms-marco-minilm-l6-v2",
  "oci": {
    "digest": "sha256:88a3ed0cffeca20e53ee628f574a9202a647f4abde458122ea169292b62a2315",
    "pullback_verified": true,
    "repository": "ghcr.io/sempersupra/model-artifact-foundry"
  },
  "schema_version": 1,
  "state": "candidate",
  "upstream": {
    "exact_revision": "233902d25c440f23af6f7d6e94d2946bac0bee0a",
    "provider": "huggingface",
    "repository": "cross-encoder/ms-marco-MiniLM-L6-v2"
  },
  "validation": {
    "claims": [
      "exact declared upstream revision reacquired and allow-listed file hashes recorded",
      "model and tokenizer load offline with trust_remote_code disabled",
      "sequence-classification output is one finite scalar per query/passage pair",
      "repeated deterministic inference is stable within 1e-6 max absolute score delta",
      "the model-card Red Planet smoke ranks the Mars passage above three distractors",
      "hidden-state observability is available for later Model Spelunker representation probes"
    ],
    "profile": "cross-encoder-msmarco-ranking-smoke-v1",
    "status": "passed",
    "tool_revision": "11b8400016e75ea672cfc52c66db3085952b1b51"
  }
}
